{
  "$schema": "https://repo.pmil.me/package.schema.json",
  "version": 1,
  "name": "git-credential-manager",
  "binary_name": "git-credential-manager",
  "files": [
    {
      "url": "https://github.com/git-ecosystem/git-credential-manager/releases/latest",
      "url_provider": "github"
    }
  ],
  "post_install_message": "Run: git-credential-manager configure\nOn Linux GUI, prefer: git config --global credential.credentialStore secretservice\nSee https://github.com/git-ecosystem/git-credential-manager/blob/release/docs/credstores.md"
}
